{
  "schema_version": "0.1.0",
  "run_id": "hcx_real_smoke_00000000000000000000000000000000",
  "created_at": "2026-09-02T00:00:00.000Z",
  "requests_attempted": 0,
  "requests_succeeded": 0,
  "requests_failed": 0,
  "retries_performed": 0,
  "scenarios": [],
  "latency_ms": null,
  "token_usage_aggregate": null,
  "estimated_cost_total": null,
  "duration_ms": 0,
  "stopped_early_reason": "MISSING_CREDENTIALS",
  "validation_checklist": [
    { "item": "missing_api_key_zero_calls", "status": "PASS", "detail": "HCX_API_KEY was not set; requests_attempted=0" }
  ]
}
